Year,Venue,Authors,Title,Tags,P,E,N
# ### Storage Systems
# #### SSD Management
2025,EuroSys,Samsung,Towards Efficient Flash Caches with Emerging NVMe Flexible Data Placement SSDs,NVMe Flexible Data Placement (FDP) SSDs for data segregation; targeted data placement for reduced device write amplification; FDP-enabled CacheLib architecture; theoretical DLWA model for CacheLib,,,
2025,arXiv,SDU,Managing Hybrid Solid-State Drives Using Large Language Models,LLM-based auto-tuning framework for hybrid SSD management; hybrid SSD parameter categorization; performance-sensitive parameter selection; prompt engineering for LLM integration; dynamic configuration optimization in hybrid SSDs,,,
# ### Memory
# #### Memory Partitioning
2024,arXiv,UMich,Mercury: QoS-Aware Tiered Memory System,contend for local memory; priority inversion; intra- and inter-tier interference; per-tier page reclaimation,,,
# #### Cache Evict
2024,NSDI,CMU,Sieve is Simpler than LRU: an Efficient Turn-Key Eviction Algorithm for Web Caches,web cache management; fifo-like schedule; recognizing the importance of objects,3,3,3
# #### LLM Memory Management
# ##### General LLM Memory Management
2025,arXiv,THU,Jenga: Effective Memory Management for Serving LLM with Heterogeneity,fixed-size embeddings; full-prefix dependency; two-level memory allocator,4,4,3
2022,NIPS,Stanford,FlashAttention: Fast and Memory-Efficient Exact Attention with IO-Awareness,Generalized Acceleration of Attention Mechanisms; Change attention to utilize the SRAM on GPU; use recompute to reduce IO burden,4,5,4
# ##### LLM Quantization Methods
2025,arXiv,UVa,HACK: Homomorphic Acceleration via Compression of the Key-Value Cache for Disaggregated LLM Inference,method without dequantization; homomorphic quantization method for matrix multiplication; requantization elimination,,,
2025,arXiv,PKU,Bitnet.cpp: Efficient Edge Inference for Ternary LLMs,ternary mpGEMM library; avoid intricate bit-level manipulations; achieving lossless inference for BitNet b1.58,,,
2025,arXiv,SJTU,MILLION: Mastering Long-Context LLM Inference Via Outlier-Immunized KV Product Quantization,a non-uniform quantization algorithm based on product quantization; leverages sparse computation and asynchronous quantization; distributes quantization power unevenly across channels,3,4,2
2025,arXiv,Rice,"70% Size, 100% Accuracy: Lossless LLM Compression for Efficient GPU Inference via Dynamic-Length Float",dynamic-length float; preserving bit-for-bit identical outputs; BFloat16 exponents carry significantly less information than their allocated bit width,4,4,4
# ##### KV Cache Storage Systems
2025,arXiv,NVIDIA,FlashInfer: Efficient and Customizable Attention Engine for LLM Inference Serving,block-sparse format; customizable attention template; dynamic load-balanced scheduling framework,,,
2025,arXiv,PKU,FairKV: Balancing Per-Head KV Cache for Fast Multi-GPU Inference,imbalanced KV cache compression mitigation; fair-copying for load balancing; best-effort assignment,,,
# ##### KV Cache Evict Systems
2023,NIPS,UT-Austin,H$_2$O: Heavy-Hitter Oracle for Efficient Generative Inference of Large Language Models,sparsity for small cache size; heavy-hitters; greedy algorithm for low-cost policy,,,
2024,arXiv,Fujitsu,CO2: Precise Attention Score Observation for improving KV Cache Replacement in Large Language Models,long measurement step; decay of the accumulated attention score; adjusting FIFO cache size,,,
# ##### KV Cache Reuse Systems
2024,arXiv,Berkeley,BlendServe: Optimizing Offline Inference for Auto-regressive Large Models with Resource-aware Batching,offline batch inference; resource-aware prefix tree; compute-intensive / memory-intensive requests,,,
2024,arXiv,UChicago,CacheBlend: Fast Large Language Model Serving for RAG with  Cached Knowledge Fusion, multiple precomputed text chunks; selective KV recompute; sparsity of attention matrices,,,
2024,arXiv,UChicago,DroidSpeak: Enhancing Cross-LLM Communication,selectively layer reuse; communication protocol for inter-agent exchanges; LLMs that share a common foundational model,,,
2024,arXiv,Microsoft,BatchLLM: Optimizing Large Batched LLM Inference with Global Prefix Sharing and Throughput-oriented Token Batching,global prefix tree ahead-of-time; request reorder; horizontal fusioned prefix-shared attention kernel,,,
2024,arXiv,Berkeley,Optimizing LLM Queries in Relational Workloads,prefix sharing maximization; KV cache hit rate; deduplication and cost estimation techniques,,,
# ##### Systems with Other Caches (Not / Not just KV Cache)
2025,arXiv,KAIST,Efficient LLM Inference with Activation Checkpointing and Hybrid Caching,activation checkpointing; KV-activation hybrid caching; balanced approach to determine the best ratio,,,
# ### Scheduling
# #### General Task Scheduling
2019,NSDI,MIT,Shinjuku: Preemptive Scheduling for µsecond-scale Tail Latency,preemptive scheduling; single-address space OS; hardware-supported virtualization,,,
2021,SOSP,UPenn,When Idling is Ideal: Optimizing Tail-Latency for Heavy-Tailed Datacenter Workloads with Perséphone,reserve cores; non-conserving; request dispatching algorithm,,,
# #### Heterogeneous Device Task Scheduling
2025,arXiv,NUS,Data-aware Dynamic Execution of Irregular Workloads on Heterogeneous Systems,lightweight and input-aware framework; multiobjective and multi-constraint design space; dynamically creating optimal schedules,,,
2025,arXiv,Georgia Tech,HARP: A Taxonomy for Heterogeneous and Hierarchical Processors for Mixed-reuse Workloads,a taxonomy to classify the heterogeneous and hierarchical accelerators; characterize hardware organization of different accelerators; classify based on relative location of sub-accelerators,,,
# #### Speculative Execution (Non-LLM)
2024,arXiv,MSR,Forerunner: Constraint-based Speculative Transaction Execution for Ethereum,constraint-based speculative transaction execution; many-future nature; specialized fast-path program,,,
2024,arXiv,Politecnico di Milano,Minimizing speculation overhead in a parallel recognizer for regular texts,speculation overhead; chunk automaton; reduced-interface DFA,,,
# #### LLM-Related Scheduling
# ##### Cloud Datacenter LLM Scheduling
2025,arXiv,Azure,TAPAS: Thermal- and Power-Aware Scheduling for LLM Inference in Cloud Platforms,thermal/power property characterization; dynamically adjust in response to power or cooling failures; thermal- and poweraware manner,,,
# ##### LLM Request Scheduling
2024,arXiv,UCSB,Multi-Bin Batching for Increasing LLM Inference Throughput,binning-based scheduling strategy; queueing-theoretical analysis; asymptotical throughput optimality,,,
2024,arXiv,Yale,TimelyLLM: Segmented LLM Serving System for Time-sensitive Robotic Applications,segmented generation; time-sensitive scheduling; latency-guided batch size selection,,,
2025,arXiv,MSRI,Niyama : Breaking the Silos of LLM Inference Serving,QoS-driven LLM inference serving system; co-scheduling requests with diverse QoS targets on a shared rather than siloed infrastructure; allows graceful service degradation during overload conditions; deadline slack; a hybrid prioritization and an eager relegation policy,4,4,3
2025,arXiv,MIT,Optimizing LLM Inference: Fluid-Guided Online Scheduling with Memory Constraints,fluid dynamics approximation; Waiting for Accumulated Inference Threshold; a hierarchical framework comprising multiple segments,3,4,2
2025,arXiv,PKU,SeaLLM: Service-Aware and Latency-Optimized Resource Sharing for Large Language Model Inference,service-aware and latency-optimized scheduling algorithm; doubling budget (DB) scheduling algorithm; search-based placement algorithm,3,4,2
# ##### LLM Application-Level Scheduling
2024,OSDI,SJTU,Parrot: Efficient Serving of LLM-based Applications with Semantic Variable,Semantic Variable; application-level information; LLM applications as first-class citizens,,,
2024,OSDI,CUHK,Teola: Towards End-to-End Optimization of LLM-based Applications,mismatch between request-level scheduling and end-to-end  application performance; primitive-level dataflow graph; two-tier scheduling mechanism,,,
2024,arXiv,Yext,SLA Management in Reconfigurable Multi-Agent RAG: A Systems Approach to Question Answering,constantly changing and sometimes adverse conditions; Dynamically Reconfigurable Horizontal Scaling Framework; dynamically adjust resource allocation based on query requirements,,,
2025,arXiv,Berkeley,Autellix: An Efficient Serving Engine for LLM Agents as General Programs,"formalize agentic programs as dynamic, non-deterministic DAGs; non-clairvoyant scheduler; simple load-balancing policy to balance data locality and KV-cache recomputation",,,
2025,ICDCS,SJTU,LLMSched: Uncertainty-Aware Workload Scheduling for Compound LLM Applications,"a DAG with regular stage, LLM stage, dynamic stage; bayesian network-based profiler; identify uncertainty-reducing stages",4,4,3
# ##### LLM Speculative Inference
# Refer to non-LLM [speculative execution](#Speculative-Execution-(Non-LLM)).
2024,arXiv,F&M College,AMUSD: Asynchronous Multi-Device Speculative Decoding for LLM Acceleration,simultaneous and independent predictions; asynchronous speculative decoding; rollback mechanism,,,
2024,arXiv,Purdue,Constrained Decoding with Speculative Lookaheads,computational expense of generating lookaheads; speculated lookaheads; task specific reward function,,,
2024,arXiv,Rutgers,Interactive Speculative Planning: Enhance Agent Efficiency through Co-design of System and User Interface,active user intervention; speculative planning algorithm; UI-level rescheduling algorithm,,,
2024,arXiv,USTC,Parallel Speculative Decoding with Adaptive Draft Length,adaptive draft length; pre-verify and post-verify; draft-then-verify framework; mutual waiting problem,,,
2024,arXiv,SEU,SEED: Accelerating Reasoning Tree Construction via Scheduled Speculative Decoding,reasoning tree construction; parallel drafting with speculative decoding; FCFS queue verification,,,
# ###### Spec + Others
2025,arXiv,Huawei,Speculative MoE: Communication Efficient Parallel MoE Inference with Speculative Token and Expert Pre-scheduling,speculative MoE; speculative token shuffling; speculative expert pre-grouping,,,
2025,INFOCOM,UoA,SPIN: Accelerating Large Language Model Inference with Heterogeneous Speculative Models,internal neurons sparsification; model-agnostic acceleration framework; dynamic early-exit thresholds; multi-layered feature fusion,,,
# ##### LLM Serving Outages and Incidents
2025,arXiv,Vrije Universiteit Amsterdam,An Empirical Characterization of Outages and Incidents in Public Services for Large Language Models,empirical characterization of outages; failure recovery optimization; public LLM service reliability,,,
# ##### Energy-Optimized LLM Scheduling
2025,arXiv,UvA,GREEN-CODE: Optimizing Energy Efficiency in Large Language Models for Code Generation,dynamic early exit; energy-aware code generation; reinforcement learning for llms,,,
# #### DNN Scheduling
# ##### Task Offloading
2024,arXiv,USTC,Collaborative Inference for Large Models with Task Offloading and Early Exiting,early exit mechanism; jointly optimize its offloading strategy and the confidence threshold; distributed task offloading algorithm,,,
# ### Distrbuted Systems
# #### Remote Memory
2020,TC,Georgia Tech,Hierarchical Orchestration of Disaggregated Memory,XMemPod architecture for hierarchical memory orchestration; compressed swap page table (CSPT) for metadata management; hybrid swap-out algorithm for memory utilization; proactive swap-in optimization for performance; RDMA-based remote memory sharing for low-latency access,,,
# #### Scratchpad Memory
2023,ASPLOS,Cornell,Beyond Static Parallel Loops: Supporting Dynamic Task Parallelism on Manycore Architectures with Software-Managed Scratchpad Memories,work-stealing based dynamic task parallelism; stack/task queue in SPM; read-only data duplication,3,3,3
# #### I/O Characterization and Optimization
2025,arXiv,UOregon,Parallel I/O Characterization and Optimization on Large-Scale HPC Systems: A 360-Degree Survey,different HPC I/O stack layers; profiling and tracing tools; tuning echniques,,,
# #### LLM Training Systems
# ##### General Optimizations
2025,arXiv,THU,Enhancing Memory Efficiency in Large Language Model Training Through Chronos-aware Pipeline Parallelism,chronos-aware pipeline parallelism; temporal locality optimization; activation balancing,,,
2025,arXiv,NUS,PipeOffload: Improving Scalability of Pipeline Parallelism with Memory Optimization,selective offload strategy; memory offload optimization; pipeline parallelism scalability; lifespan-based offloading,,,
2025,arXiv,UCSD,WLB-LLM: Workload-Balanced 4D Parallelism for Large Language Model Training,workload-aware variable-length document packing; per-document sharding strategy; adaptive sharding selection mechanism; delay execution of extremely long documents,4,5,2
2025,EuroSys,UToronto,Mist: Efficient Distributed Training of Large Language Models via Memory-Parallelism Co-Optimization,fine-grained overlap-centric scheduling; symbolic-based performance analysis; imbalance-aware hierarchical tuning,4,4,2
# ##### Parallel Stragety
2022,ACL,NUS,Sequence Parallelism: Long Sequence Training from System Perspective,splits input sequences into chunks; Ring Self-Attention; sparse attention,3,4,3
# ##### Optimizations on Special Scene
2025,arXiv,HKU,Hecate: Unlocking Efficient Sparse Model Training via Fully Sharded Sparse Data Parallelism,Fully Sharded Sparse Data Parallelism (FSSDP); sparsely materializes MoE parameters; two sparse collective communications,,,
2025,arXiv,SJTU,PipeWeaver: Addressing Data Dynamicity in Large Multimodal Model Training with Dynamic Interleaved Pipeline,dynamic interleaved pipeline; hierarchical schedule space for rapid pipeline schedule search; spatialtemporal subgraph reuse,3,4,2
# ##### Experiments
2025,arXiv,JSC,Memory and Bandwidth are All You Need for Fully Sharded Data Parallel,an extensive analysis of the FSDP training distribution strategy; a grid search methodology; both simulation and empirical results,2,4,1
# ##### Multi-Modal Optimizations
2025,arXiv,ByteDance,OrchMLLM: Orchestrate Multimodal Data with Batch Post-Balancing to Accelerate Multimodal Large Language Model Training,multimodal mini-batch imbalance; batch post-balancing algorithm; node-wise all-to-all communicator for practical rearrangement of mini-batches,4,4,3
# ##### Kernel-Level Optimizations
2025,arXiv,HUST,CFP: Low-overhead Profiling-based Intra-operator Parallelism Generation by Preserving Communication-Free Structures,model segment profile-based cost model; communication-free tensor partition propagation property; extracting a set of unique model segments; Communication-Free Preserve,4,5,3
# ##### Performance Modeling
2025,MLSys,Cornell,Lumos: Efficient Performance Modeling and Estimation for Large-scale LLM Training,trace-driven performance modeling and estimation toolkit; the first system to provide accurate performance models that effectively capture the execution behaviors of LLMs; modify and generate new execution graphs from existing traces,3,4,2
# #### Many-Core Systems
2018,SC,Intel,Many-Core Graph Workload Analysis,multicore simulator sniper; selective caching and prefetching; heterogeneous high-performance low-power cores,,,
2018,DATE,UGA,Parallel Code Generation of Synchronous Programs for a Many-core Architecture,banked memory mapping; worst-case response time analysis,,,
2025,IPDPS,UChicago,Optimizing Fine-Grained Parallelism Through Dynamic Load Balancing on Multi-Socket Many-Core Systems,lock-less and concurrent task queue xqueue; distributed tree barrier; NUMA-aware redirect push/work stealing,,,
# ##### Fault Propagation
2008,ASPLOS,UIUC,Understanding the Propagation of Hard Errors to Software and Implications for Resilient System Design,stuck-at fault; bridging fault; software failure detection,,,
2010,PRDC,UBC,Modeling the Propagation of Intermittent Hardware Faults in Programs,instruction based intermittent fault; dynamic dependency graph(DDG) based propagation modeling,,,
2015,SC,IBM,Understanding the Propagation of Transient Errors in HPC Applications,"fault propagation in MPI application; fault classification:V,ONA,WO,PEX,C; fault propagation speed factors",,,
2023,ISCA,UChicago,Understanding and Mitigating Hardware Failures in Deep Learning Training Accelerator Systems,"NVDLA based fault injection framework; re-execution based light-weight recovery technique; failure effects:SlowDegrade,SharpSlowDegrade,SharpDegrade,LowTestAccuracy",,,
# ##### Fault Injection Technique
2008,VLSI,DISCA,Enhancement of Fault Injection Techniques Based on the Modification of VHDL Code,saboteurs and mutants technique based fault injection; VHDL level fault-tolerance mechanism,,,
2014,DSN,UBC,Quantifying the Accuracy of High-Level Fault Injection Techniques for Hardware Faults,fault injection quantification; assembly level fault injection; LLVM compiler based fault injector,,,
# ##### Communication
2025,arXiv,UCLM,Understanding intra-node communication in HPC systems and Datacenters,intra- and inter-node simulation model; intra-node network interface bottleneck; impacts of communication pattern,,,
# #### LLM Inference Systems
# ##### Communication-Focused Systems
2025,arXiv,Apple,SPD: Sync-Point Drop for efficient tensor parallelism of Large Language Models,sync-point drop; block-wise sensitivity analysis; attention output synchronization reduction,,,
# ##### SLO-Aware Systems
2025,arXiv,Berkeley,AdaServe: SLO-Customized LLM Serving with Fine-Grained Speculative Decoding,fine-grained speculative decoding; token tree verification; slo customization,,,
2025,arXiv,UIUC,HyGen: Efficient LLM Serving via Elastic Online-Offline Request Co-location,online-offline request co-location; interference-aware profiler; latency predictor; adaptive scheduler,,,
2025,arXiv,PKU,Memory Offloading for Large Language Model Inference with Latency SLO Guarantees,effectively captures the tension between meeting SLOs and maximizing host memory usage; dynamic offloading interval; per-bus coordinator,,,
2025,arXiv,Huawei,Hybrid Offline-online Scheduling Method for Large Language Model Inference Optimization,hybrid offline-online scheduling; preemptive scheduling for hardware utilization; lagrangian method for cost efficiency evaluation,,,
2025,FAST,THU,Mooncake: Trading More Storage for Less Computation — A KVCache-centric Architecture for Serving LLM Chatbot,PD-disaggregate system; kv-cache centered; global kv-cache pool; dynamic SLO scheduler; paged KV-Cache storage,3,4,2
# ##### Surveys
# ###### System Optimization Surveys
2024,arXiv,NEU,LLM Inference Serving: Survey of Recent Advances and Opportunities,KV cache and memory management; LLM computation optimization; Cloud LLM deployment; focus on system-level enhancements,,,
2024,arXiv,CUHK,A Survey on Inference Optimization Techniques for Mixture of Experts Models,model compression; expert skip; expert merge; sparse to dense; expert parallel; expert offloading,,,
2024,arXiv,PolyU,A Survey on Large Language Model Acceleration based on KV Cache Management,cache selection; budget allocation; cache merging; cache quantization; cache low-rank decomposition; attention grouping and sharing; memory management; hardware-aware design,,,
2025,arXiv,THU,Beyond A Single AI Cluster: A Survey of Decentralized LLM Training,resource-driven paradigm; community-driven decentralization; organizational decentralization; decentralized LLM training taxonomy,,,
2025,arXiv,FIU,"Distributed LLMs and Multimodal Large Language Models: A Survey on Advances, Challenges, and Future Directions",distributed solutions for LMs; workload imbalance in LLM training; M-ICL; model security enhancement,,,
# ###### Application Surveys
2024,arXiv,PKU,Retrieval-Augmented Generation for AI-Generated Content: A Survey,Query Transformation; Data Augmentation; Recursive Retrieval; Chunk Optimization; Retriever Finetuning; Hybrid Retrieval; Re-ranking; Retrieval Transformation; Prompt Engineering; Decoding Tuning; Generator Finetuning; Output Rewrite; Adaptive Retrieval; Iterative RAG,,,
2024,arXiv,WHU,"A survey on LLM-based multi-agent systems: workflow, infrastructure, and challenges",personalized characteristics; perceive environmental information; utilize memory mechanisms; mutual interaction; agent self-reflection,,,
2024,arXiv,PolyU,Deploying Foundation Model Powered Agent Services: A Survey,FM-powered agent services within the edge-cloud environment; low-level hardware perspective; high-level software perspective,,,
# ##### Multimodal Systems
2025,arXiv,UW–Madison,LV-XAttn: Distributed Cross-Attention for Long Visual Inputs in Multimodal Large Language Models,query-block distributed exchange; shared visual token recomputation; sequence-parallelism with minimal communication overhead,,,
2025,arXiv,Microsoft,Towards Efficient Large Multimodal Model Serving,fine-grained stage-aware resource management; multimodal workload-specific scheduling; model architecture-specific optimizations,,,
2025,arXiv,Huawei,Efficiently Serving Large Multimedia Models Using EPD Disaggregation,encode-prefill-decode disaggregation; multimodal cache; intra-request parallel,,,
2025,arXiv,TU/e,Fine-tuning Multimodal Transformers on Edge: A Parallel Split Learning Approach,Multimodal Parallel Split Learning; computation-efficient training; server-side loss aggregation mechanism,,,
2025,arXiv,HUST,FastCache: Optimizing Multimodal LLM Serving through Lightweight KV-Cache Compression Framework,resource-aware KV-cache memory pool; multimodal KV-cache compression; modality-specific compression,,,
# ##### Mixture-of-Experts LLM Systems
# ###### Expert Offloading and Placement
2025,DATE,Berkeley,DAOP: Data-Aware Offloading and Predictive Pre-Calculation for Efficient MoE Inference,data-aware offloading; predictive pre-calculation; sequence-specific expert allocation,,,
2025,arXiv,Stevens Tech,fMoE: Fine-Grained Expert Offloading for Large Mixture-of-Experts Serving,expert map; iteration-level probability distributions; track fine-grained input semantic embeddings; semantic-based and trajectorybased,,,
2025,arXiv,Georgia Tech,MoETuner: Optimized Mixture of Expert Serving with Balanced Expert Placement and Token Routing,ILP for expert placement; cross-layer dependencies; minimizing total dispatched token number,,,
2025,EuroMLSys,EPFL,Accelerating MoE Model Inference with Expert Sharding,expert sharding for load balancing; tensor sharding for moe experts; fused expert computations for reduced kernel launches,,,
2025,DAC,PKU,HybriMoE: Hybrid CPU-GPU Scheduling and Cache Management for Efficient MoE Inference,dynamically balances workloads across GPUs and CPUs; impact-driven prefetching; MoE-specialized cache management,3,4,2
# ###### Batching and Scheduling
2025,arXiv,Alibaba,Static Batching of Irregular Workloads on GPUs: Framework and Application to Efficient MoE Model Inference,statically batching irregular workloads; batch-task-tile partition; decompress the mapping and dispatch the workload,,,
2025,arXiv,Edinburgh,MoE-Gen: High-Throughput MoE Inference on a Single GPU with Module-Based Batching,module-based batching; high-throughput MoE inference; full KV-cache offloading,,,
2025,arXiv,KTH,Priority-Aware Preemptive Scheduling for Mixed-Priority Workloads in MoE Inference,fine-grained preemption; priority-aware scheduling; per-expert queues; expert-level preemption,,,
2025,arXiv,UMich,MoE-Lens: Towards the Hardware Limit of High-Throughput MoE LLM Serving Under Resource Constraints,two-stage performance modeling; analyzes the theoretical performance upper bound; captures how system execution mechanisms,4,4,2
2025,Arxiv,Nvidia,MoE Parallel Folding: Heterogeneous Parallelism Mappings for Efficient Large-Scale MoE Model Training with Megatron Core,decouples parallelization strategies for attention and MoE layers; flexible and efficient token-level dispatcher; 5-D hybrid parallelism,4,5,2
# ###### Memory and Communication Efficiency
2025,arXiv,ByteDance,Comet: Fine-grained Computation-communication Overlapping for Mixture-of-Experts,fine-grained communication-computation overlapping for efficient MoE execution; dependency resolving method; adaptive workload assignment method; shared data buffers between communication and computation operations,,,
2025,arXiv,UVA,eMoE: Task-aware Memory Efficient Mixture-of-Experts-Based (MoE) Model Inference,expert prediction; task-aware expert loading; task-aware request scheduling,,,
2025,mobiCom,HKUST,D$^{2}$MoE: Dual Routing and Dynamic Scheduling for Efficient On-Device MoE-based LLM Serving,dually sparselygated Mixture-of-Experts; token-adaptive bit-width selection; matryoshka weight quantization; bit-width-aware I/O-compute pipeline,3,4,4
2025,ODSI,SJTU,Fast and Live Model Auto Scaling with O(1) Host Caching,auto-scaling with minimal caching; optimize parameter loading; enabling fine-grained layer-level scale,3,3,2
# ###### Architectural Innovations
2025,arXiv,Shanghai AI,Linear-MoE: Linear Sequence Modeling Meets Mixture-of-Experts,linear sequence modeling with MoE; sparse activation via moe layers; hybrid models combining linear-moe and transformer-moe layers,,,
2025,arXiv,Berkeley,HeterMoE: Efficient Training of Mixture-of-Experts Models on Heterogeneous GPUs,zebra parallelism; attention-expert disaggregation; asymmetric expert assignment mechanism; gather and squeeze strategy,4,5,3
# ###### Compute-Kernel-Level Optimizations
2025,arXiv,SJTU,Samoyeds: Accelerating MoE Models with Structured Sparsity Leveraging Sparse Tensor Cores,dual-side structured sparsity; sparse-sparse matrix multiplication kernel; vector-wise + 2:4 hybrid sparsity; token-aware activation compression,,,
# ##### Long Sequence LLM Systems
