Year,Venue,Authors,Title,Tags,P,E,N
# Challenge: effectively hiding communication latency by overlapping it with computation, which requires careful scheduling and resource management to avoid bottlenecks and ensure that both communication and computation proceed efficiently without stalling each other.
2023,NSDI,KAIST,ARK: GPU-driven Code Execution for Distributed Deep Learning,communication-motivated DL system; pipeline DMA engine; GPU-direct-controlled DMA,,,
2024,ASPLOS,PKU,Centauri: Enabling Efficient Scheduling for Communication-Computation Overlap in Large Model Training via Communication Partitioning,communication partition abstraction; hybrid LLM training tasks; 3-level decompose,,,
2024,ASPLOS,UW–Madison,T3: Transparent Tracking & Triggering for Fine-grained Overlap of Compute & Collectives,lightweight track and trigger; pre-programmed DMA commands; atomic memory update,,,
2024,ASPLOS,UIUC,Two-Face: Combining Collective and One-Sided Communication for Efficient Distributed SpMM,distributed SpMM; sparsity-aware partition; Synchronous Stripes and Asynchronous Stripes,,,
2024,arXiv,AMD,Optimizing ML Concurrent Computation and Communication with GPU DMA Engines,concurrent computation and communication; compute and memory interference among concurrent kernels; schedule prioritization and careful resource partitioning,,,

# ### Configuration Optimization
# Challenge: the configuration space is too large to be searched manually.
2025,OSDI,PKU,Mirage: A Multi-Level Superoptimizer for Tensor Programs,auto algebraically transfer tensor; using DAG to search configuration space; auto generate kernel function,4,4,3
2020,ASPLOS,PKU,FlexTensor: An Automatic Schedule Exploration and Optimization Framework for Tensor Computation on Heterogeneous System,tvm auto schedule; RL based stragety find; auto optimizing in large configuration space,4,4,3
