Year,Venue,Authors,Title,Tags,P,E,N
2021,SOSP,UPenn,When Idling is Ideal: Optimizing Tail-Latency for Heavy-Tailed Datacenter Workloads with Perséphone,reserve cores; non-conserving; request dispatching algorithm,,,
2017,HPCA,UGent,Reliability-Aware Scheduling on Heterogeneous Multicore Processors,core reliability characteristics difference; system soft error rate; sampling-based reliability-aware scheduling algorithm,,,
2020,TCAD,ASU,Runtime Task Scheduling Using Imitation Learning for Heterogeneous Many-Core Systems,offline Oracle optimizaion strategy; hierarchical imitation learning based scheduling; two-level scheduling,,,

# ### Speculative Execution (Non-LLM) <a name="Speculative-Execution-Non-LLM"></a>
# Solution: balancing the potential performance gains from speculative executions, including accurately predicting outcomes, handling incorrect speculations and their side effects across multiple nodes.
# Refer to [Speculative Execution](#Speculative-Execution-LLM) for the speculative execution algorithms for LLM.
2024,arXiv,MSR,Forerunner: Constraint-based Speculative Transaction Execution for Ethereum,constraint-based speculative transaction execution; many-future nature; specialized fast-path program,,,
2024,arXiv,Politecnico di Milano,Minimizing speculation overhead in a parallel recognizer for regular texts,speculation overhead; chunk automaton; reduced-interface DFA,,,

# ### LLM-Related Scheduling <a name="LLM-Related-Scheduling"></a>
# Challenge: efficiently managing the immense computational and memory demands of training and inference across numerous interconnected devices, requiring sophisticated strategies to partition massive models.

# #### LLM Request Scheduling
# Solution: develop intelligent strategies to route requests, prioritize urgent or critical tasks, handle varying input lengths and complexities, manage resource contention to meet the SLO requirements.
2024,arXiv,UCSB,Multi-Bin Batching for Increasing LLM Inference Throughput,binning-based scheduling strategy; queueing-theoretical analysis; asymptotical throughput optimality,,,
2024,arXiv,Yale,TimelyLLM: Segmented LLM Serving System for Time-sensitive Robotic Applications,segmented generation; time-sensitive scheduling; latency-guided batch size selection,,,
2025,arXiv,MSRI,Niyama : Breaking the Silos of LLM Inference Serving,QoS-driven LLM inference serving system; co-scheduling requests with diverse QoS targets on a shared rather than siloed infrastructure; allows graceful service degradation during overload conditions; deadline slack; a hybrid prioritization and an eager relegation policy,4,4,3
2025,arXiv,MIT,Optimizing LLM Inference: Fluid-Guided Online Scheduling with Memory Constraints,fluid dynamics approximation; Waiting for Accumulated Inference Threshold; a hierarchical framework comprising multiple segments,3,4,2
2025,arXiv,PKU,SeaLLM: Service-Aware and Latency-Optimized Resource Sharing for Large Language Model Inference,service-aware and latency-optimized scheduling algorithm; doubling budget (DB) scheduling algorithm; search-based placement algorithm,3,4,2

# ##### Info Predict Scheduling
# Challenge: The general schedule if for better batching and meeting the SLO requirements. By predicting the information of the requests, we can make the schedule more efficient.
2023,Nips,Harvard,S3: Increasing GPU Utilization during Generative Inference for Higher Throughput,predict the length of LLM request to fixed types; Orca based dynamic batching,3,2,3
2024,ASPLOS,UIUC,Efficient Interactive LLM Serving with Proxy Model-based Sequence Length Prediction,length prediction; left time prediction; bert-based proxy model,4,3,2

# #### LLM Application-Level Scheduling
# Solution: to optimize the end-to-end latency of the application, including the scheduling of the LLM instances.
2024,OSDI,SJTU,Parrot: Efficient Serving of LLM-based Applications with Semantic Variable,Semantic Variable; application-level information; LLM applications as first-class citizens,,,
2024,OSDI,CUHK,Teola: Towards End-to-End Optimization of LLM-based Applications,mismatch between request-level scheduling and end-to-end  application performance; primitive-level dataflow graph; two-tier scheduling mechanism,,,
2024,arXiv,Yext,SLA Management in Reconfigurable Multi-Agent RAG: A Systems Approach to Question Answering,constantly changing and sometimes adverse conditions; Dynamically Reconfigurable Horizontal Scaling Framework; dynamically adjust resource allocation based on query requirements,,,
2025,arXiv,Berkeley,Autellix: An Efficient Serving Engine for LLM Agents as General Programs,"formalize agentic programs as dynamic, non-deterministic DAGs; non-clairvoyant scheduler; simple load-balancing policy to balance data locality and KV-cache recomputation",,,
2025,ICDCS,SJTU,LLMSched: Uncertainty-Aware Workload Scheduling for Compound LLM Applications,"a DAG with regular stage, LLM stage, dynamic stage; bayesian network-based profiler; identify uncertainty-reducing stages",4,4,3
2025,arXiv,SJTU,Efficient Serving of LLM Applications with Probabilistic Demand Modeling,DAG-based scheduling; dynamic excution; cpu excutor warmup,3,1,1

# #### LLM Speculative Inference <a name="Speculative-Execution-LLM"></a>
# Refer to non-LLM [speculative execution](#Speculative-Execution-Non-LLM).
2024,arXiv,F&M College,AMUSD: Asynchronous Multi-Device Speculative Decoding for LLM Acceleration,simultaneous and independent predictions; asynchronous speculative decoding; rollback mechanism,,,
2024,arXiv,Purdue,Constrained Decoding with Speculative Lookaheads,computational expense of generating lookaheads; speculated lookaheads; task specific reward function,,,
2024,arXiv,Rutgers,Interactive Speculative Planning: Enhance Agent Efficiency through Co-design of System and User Interface,active user intervention; speculative planning algorithm; UI-level rescheduling algorithm,,,
2024,arXiv,USTC,Parallel Speculative Decoding with Adaptive Draft Length,adaptive draft length; pre-verify and post-verify; draft-then-verify framework; mutual waiting problem,,,
2024,arXiv,SEU,SEED: Accelerating Reasoning Tree Construction via Scheduled Speculative Decoding,reasoning tree construction; parallel drafting with speculative decoding; FCFS queue verification,,,

# ##### Spec + Others
2025,arXiv,Huawei,Speculative MoE: Communication Efficient Parallel MoE Inference with Speculative Token and Expert Pre-scheduling,speculative MoE; speculative token shuffling; speculative expert pre-grouping,,,
2025,INFOCOM,UoA,SPIN: Accelerating Large Language Model Inference with Heterogeneous Speculative Models,internal neurons sparsification; model-agnostic acceleration framework; dynamic early-exit thresholds; multi-layered feature fusion,,,
2025,arXic,SUST,FlowSpec: Continuous Pipelined Speculative Decoding for Efficient Distributed LLM Inference,SPEC on memory limited dedvices; Efficient draft management with tree pruning and early stop reduces redundancy and maintains causal relationships,3,3,3

# #### LLM Serving Outages and Incidents
2025,arXiv,Vrije Universiteit Amsterdam,An Empirical Characterization of Outages and Incidents in Public Services for Large Language Models,empirical characterization of outages; failure recovery optimization; public LLM service reliability,,,

# #### Energy-Optimized LLM Scheduling
2025,arXiv,UvA,GREEN-CODE: Optimizing Energy Efficiency in Large Language Models for Code Generation,dynamic early exit; energy-aware code generation; reinforcement learning for llms,,,

# ### DNN Scheduling
# Solution: optimizing data parallelism and model parallelism while minimizing communication overhead between nodes, effectively managing limited GPU memory and other resources to achieve scalability and high throughput.
# Refer to [LLM-Related Scheduling](#LLM-Related-Scheduling) for the LLM-related scheduling algorithms.

# #### Task Offloading
2024,arXiv,USTC,Collaborative Inference for Large Models with Task Offloading and Early Exiting,early exit mechanism; jointly optimize its offloading strategy and the confidence threshold; distributed task offloading algorithm,,,
2025,ISCA,ETHZ,OptiPIM: Optimizing Processing-in-Memory Acceleration Using Integer Linear Programming,integer linear programming for offload optimization; PIM-friendly mapping representation; accurate cost modeling for data layout,4,2,3

# ## General optimizations for Deep Learning Systems
# Solution: general optimizations for deep learning systems.
# If the paper is focusing on an above-mentioned specific scene (e.g., memory, scheduling, IO, etc.), it will be put in the corresponding section.

# ### LLM Training Systems
# Solution: arrange model parameters and data across multiple devices, reduce the time spent communicating, scale up smoothly as models and data keep growing—all while staying efficient and speeding up training.

# #### General Optimizations
2025,arXiv,THU,Enhancing Memory Efficiency in Large Language Model Training Through Chronos-aware Pipeline Parallelism,chronos-aware pipeline parallelism; temporal locality optimization; activation balancing,,,
2025,arXiv,NUS,PipeOffload: Improving Scalability of Pipeline Parallelism with Memory Optimization,selective offload strategy; memory offload optimization; pipeline parallelism scalability; lifespan-based offloading,,,
2025,arXiv,UCSD,WLB-LLM: Workload-Balanced 4D Parallelism for Large Language Model Training,workload-aware variable-length document packing; per-document sharding strategy; adaptive sharding selection mechanism; delay execution of extremely long documents,4,5,2
2025,EuroSys,UToronto,Mist: Efficient Distributed Training of Large Language Models via Memory-Parallelism Co-Optimization,fine-grained overlap-centric scheduling; symbolic-based performance analysis; imbalance-aware hierarchical tuning,4,4,2

# #### Optimizations on Special Scene
2025,arXiv,HKU,Hecate: Unlocking Efficient Sparse Model Training via Fully Sharded Sparse Data Parallelism,Fully Sharded Sparse Data Parallelism (FSSDP); sparsely materializes MoE parameters; two sparse collective communications,,,
2025,arXiv,SJTU,PipeWeaver: Addressing Data Dynamicity in Large Multimodal Model Training with Dynamic Interleaved Pipeline,dynamic interleaved pipeline; hierarchical schedule space for rapid pipeline schedule search; spatialtemporal subgraph reuse,3,4,2

# #### Experiments
2025,arXiv,JSC,Memory and Bandwidth are All You Need for Fully Sharded Data Parallel,an extensive analysis of the FSDP training distribution strategy; a grid search methodology; both simulation and empirical results,2,4,1

# #### Multi-Modal Optimizations
# Challenge: multimodal data is more complex and requires more resources to train.
2025,arXiv,ByteDance,OrchMLLM: Orchestrate Multimodal Data with Batch Post-Balancing to Accelerate Multimodal Large Language Model Training,multimodal mini-batch imbalance; batch post-balancing algorithm; node-wise all-to-all communicator for practical rearrangement of mini-batches,4,4,3

# #### Kernel-Level Optimizations
2025,arXiv,HUST,CFP: Low-overhead Profiling-based Intra-operator Parallelism Generation by Preserving Communication-Free Structures,model segment profile-based cost model; communication-free tensor partition propagation property; extracting a set of unique model segments; Communication-Free Preserve,4,5,3

# ### LLM Inference Systems
# Focusing on the optimizations for LLM inference systems.
2025,ISCA,DeepSeek,Insights into DeepSeek-V3: Scaling Challenges and Reflections on Hardware for AI Architectures,software-hardware co-design for deepseek-v3; insight into hardware for ai architectures,5,5,4
2024,Mlsys,SJTU,FlashDecoding++: Faster Large Language Model Inference on GPUs,asynchronized softmax with unified max value; flat GEMM optimization with double buffering; heuristic dataflow with hardware resource adaptation,4,4,3

# #### SLO-Aware Systems
# Challenge: providing service for users to meet specific latency requirements with limited resources.
2025,arXiv,Berkeley,AdaServe: SLO-Customized LLM Serving with Fine-Grained Speculative Decoding,fine-grained speculative decoding; token tree verification; slo customization,,,
2025,arXiv,UIUC,HyGen: Efficient LLM Serving via Elastic Online-Offline Request Co-location,online-offline request co-location; interference-aware profiler; latency predictor; adaptive scheduler,,,
2025,arXiv,PKU,Memory Offloading for Large Language Model Inference with Latency SLO Guarantees,effectively captures the tension between meeting SLOs and maximizing host memory usage; dynamic offloading interval; per-bus coordinator,,,
2025,arXiv,Huawei,Hybrid Offline-online Scheduling Method for Large Language Model Inference Optimization,hybrid offline-online scheduling; preemptive scheduling for hardware utilization; lagrangian method for cost efficiency evaluation,,,
2025,ASPLOS,BUAA,Past-Future Scheduler for LLM Serving under SLA Guarantees,lightLLM; predict future system memory usage; reduce evict by better request scheduling,3,2,3

# #### Surveys

# ##### System Optimization Surveys
2024,arXiv,NEU,LLM Inference Serving: Survey of Recent Advances and Opportunities,KV cache and memory management; LLM computation optimization; Cloud LLM deployment; focus on system-level enhancements,,,
2024,arXiv,CUHK,A Survey on Inference Optimization Techniques for Mixture of Experts Models,model compression; expert skip; expert merge; sparse to dense; expert parallel; expert offloading,,,
2024,arXiv,PolyU,A Survey on Large Language Model Acceleration based on KV Cache Management,cache selection; budget allocation; cache merging; cache quantization; cache low-rank decomposition; attention grouping and sharing; memory management; hardware-aware design,,,
2025,arXiv,THU,Beyond A Single AI Cluster: A Survey of Decentralized LLM Training,resource-driven paradigm; community-driven decentralization; organizational decentralization; decentralized LLM training taxonomy,,,
2025,arXiv,FIU,"Distributed LLMs and Multimodal Large Language Models: A Survey on Advances, Challenges, and Future Directions",distributed solutions for LMs; workload imbalance in LLM training; M-ICL; model security enhancement,,,

# ##### Application Surveys
2024,arXiv,PKU,Retrieval-Augmented Generation for AI-Generated Content: A Survey,Query Transformation; Data Augmentation; Recursive Retrieval; Chunk Optimization; Retriever Finetuning; Hybrid Retrieval; Re-ranking; Retrieval Transformation; Prompt Engineering; Decoding Tuning; Generator Finetuning; Output Rewrite; Adaptive Retrieval; Iterative RAG,,,
2024,arXiv,WHU,"A survey on LLM-based multi-agent systems: workflow, infrastructure, and challenges",personalized characteristics; perceive environmental information; utilize memory mechanisms; mutual interaction; agent self-reflection,,,
2024,arXiv,PolyU,Deploying Foundation Model Powered Agent Services: A Survey,FM-powered agent services within the edge-cloud environment; low-level hardware perspective; high-level software perspective,,,

# #### Multimodal Systems
2025,arXiv,UW–Madison,LV-XAttn: Distributed Cross-Attention for Long Visual Inputs in Multimodal Large Language Models,query-block distributed exchange; shared visual token recomputation; sequence-parallelism with minimal communication overhead,,,
2025,arXiv,Microsoft,Towards Efficient Large Multimodal Model Serving,fine-grained stage-aware resource management; multimodal workload-specific scheduling; model architecture-specific optimizations,,,
2025,arXiv,Huawei,Efficiently Serving Large Multimedia Models Using EPD Disaggregation,encode-prefill-decode disaggregation; multimodal cache; intra-request parallel,,,
2025,arXiv,TU/e,Fine-tuning Multimodal Transformers on Edge: A Parallel Split Learning Approach,Multimodal Parallel Split Learning; computation-efficient training; server-side loss aggregation mechanism,,,
2025,arXiv,HUST,FastCache: Optimizing Multimodal LLM Serving through Lightweight KV-Cache Compression Framework,resource-aware KV-cache memory pool; multimodal KV-cache compression; modality-specific compression,,,

# #### Mixture-of-Experts LLM Systems
# Challenge: efficiently coordinating and scaling expert models across multiple nodes, leading to issues like uneven workload distribution, high communication overhead, and difficulty in fault tolerance.

# ##### Expert Offloading and Placement
2025,DATE,Berkeley,DAOP: Data-Aware Offloading and Predictive Pre-Calculation for Efficient MoE Inference,data-aware offloading; predictive pre-calculation; sequence-specific expert allocation,,,
2025,arXiv,Stevens Tech,fMoE: Fine-Grained Expert Offloading for Large Mixture-of-Experts Serving,expert map; iteration-level probability distributions; track fine-grained input semantic embeddings; semantic-based and trajectorybased,,,
2025,arXiv,Georgia Tech,MoETuner: Optimized Mixture of Expert Serving with Balanced Expert Placement and Token Routing,ILP for expert placement; cross-layer dependencies; minimizing total dispatched token number,,,
2025,EuroMLSys,EPFL,Accelerating MoE Model Inference with Expert Sharding,expert sharding for load balancing; tensor sharding for moe experts; fused expert computations for reduced kernel launches,,,
2025,DAC,PKU,HybriMoE: Hybrid CPU-GPU Scheduling and Cache Management for Efficient MoE Inference,dynamically balances workloads across GPUs and CPUs; impact-driven prefetching; MoE-specialized cache management,3,4,2

# ##### Batching and Scheduling
2025,arXiv,Alibaba,Static Batching of Irregular Workloads on GPUs: Framework and Application to Efficient MoE Model Inference,statically batching irregular workloads; batch-task-tile partition; decompress the mapping and dispatch the workload,,,
2025,arXiv,Edinburgh,MoE-Gen: High-Throughput MoE Inference on a Single GPU with Module-Based Batching,module-based batching; high-throughput MoE inference; full KV-cache offloading,,,
2025,arXiv,KTH,Priority-Aware Preemptive Scheduling for Mixed-Priority Workloads in MoE Inference,fine-grained preemption; priority-aware scheduling; per-expert queues; expert-level preemption,,,
2025,arXiv,UMich,MoE-Lens: Towards the Hardware Limit of High-Throughput MoE LLM Serving Under Resource Constraints,two-stage performance modeling; analyzes the theoretical performance upper bound; captures how system execution mechanisms,4,4,2
2025,Arxiv,Nvidia,MoE Parallel Folding: Heterogeneous Parallelism Mappings for Efficient Large-Scale MoE Model Training with Megatron Core,decouples parallelization strategies for attention and MoE layers; flexible and efficient token-level dispatcher; 5-D hybrid parallelism,4,5,2

# ##### Memory and Communication Efficiency
2025,arXiv,ByteDance,Comet: Fine-grained Computation-communication Overlapping for Mixture-of-Experts,fine-grained communication-computation overlapping for efficient MoE execution; dependency resolving method; adaptive workload assignment method; shared data buffers between communication and computation operations,,,
2025,arXiv,UVA,eMoE: Task-aware Memory Efficient Mixture-of-Experts-Based (MoE) Model Inference,expert prediction; task-aware expert loading; task-aware request scheduling,,,
2025,mobiCom,HKUST,D$^{2}$MoE: Dual Routing and Dynamic Scheduling for Efficient On-Device MoE-based LLM Serving,dually sparselygated Mixture-of-Experts; token-adaptive bit-width selection; matryoshka weight quantization; bit-width-aware I/O-compute pipeline,3,4,4
2025,ODSI,SJTU,Fast and Live Model Auto Scaling with O(1) Host Caching,auto-scaling with minimal caching; optimize parameter loading; enabling fine-grained layer-level scale,3,3,2

# ##### Architectural Innovations
2025,arXiv,Shanghai AI,Linear-MoE: Linear Sequence Modeling Meets Mixture-of-Experts,linear sequence modeling with MoE; sparse activation via moe layers; hybrid models combining linear-moe and transformer-moe layers,,,
2025,arXiv,Berkeley,HeterMoE: Efficient Training of Mixture-of-Experts Models on Heterogeneous GPUs,zebra parallelism; attention-expert disaggregation; asymmetric expert assignment mechanism; gather and squeeze strategy,4,5,3

# ##### Compute-Kernel-Level Optimizations
2025,arXiv,SJTU,Samoyeds: Accelerating MoE Models with Structured Sparsity Leveraging Sparse Tensor Cores,dual-side structured sparsity; sparse-sparse matrix multiplication kernel; vector-wise + 2:4 hybrid sparsity; token-aware activation compression,,,

# #### Long Sequence LLM Systems
2024,OSDI,SJTU & Alibaba,Infinite-LLM: Efficient LLM Service for Long Context with DistAttention and Distributed KVCache,inefficient model parallelism intra-instance; inefficient resource management inter-instance; KV cache scheduling,,,
2025,arXiv,PKU,"ByteScale: Efficient Scaling of LLM Training with a 2048K Context Length on More Than 12,000 GPUs",hybrid data parallelism; data-aware sharding; a heuristic algorithm that reorganizes data assignment based on the characteristics of data and pipeline parallelism,,,

# ##### Sparse Attention
# Solution: handle the prompt token by token introduce high latency, trying to use sparse attention to reduce the computation and memory burden. This can be achieved by not using the full attention matrix, but only the upper triangular part.
2025,arXiv,CWRU,Longer Attention Span: Increasing Transformer Context Length with Sparse Graph Processing Techniques,sparse attention with graph computing perspective; work-optimal graph algorithms; achieve true sparsity,,,
2025,MLSys,MIT,LServe: Efficient Long-sequence LLM Serving with Unified Sparse Attention,unified sparse attention; hybrid static and dynamic sparsity; hierarchical kv cache management with query-centric pruning,,,
2025,arXiv,THU,Twilight: Adaptive Attention Sparsity with Hierarchical Top-$p$ Pruning, use top-p method, p means the sum of chosen tokens' scores,3,3,3

# ##### Ring Computation
# Solution: use the device layout to reduce the communication overhead. The key idea is to parallel the computation and communication.
2023,Nips,UCB,Ring Attention with Blockwise Transformers for Near-Infinite Context,divide the input into blocks and each block is processed by a single GPU; ring-type device layout,4,3,3
2024,arXiv,SJTU,TokenRing: An Efficient Parallelism Framework for Infinite-Context LLMs via Bidirectional Communication,communication-oriented parallelism framework; inter-node P2P bidirectional communication bandwidth; optimization of attention block communication,,,


# #### P-D Disaggregated Systems
2024,OSDI,PKU,DistServe: Disaggregating Prefill and Decoding for Goodput-optimized Large Language Model Serving,goodput-optimized; prefill-decoding interference;novel placement algorithm for p-d schema,,,
2024,ISCA,UW,Splitwise: Efficient Generative LLM Inference Using Phase Splitting,optimized cache context transfer; performance per dollar; performance per watt; exploration of homogeneous and heterogeneous cluster deployments,,,
2024,arXiv,CMU,A System for Microserving of LLMs,fine-grained sub-request level actions; dynamic reconfiguration according to workloads; unified KV cache abstraction,,,
2025,arXiv,PKU,ThunderServe: High-performance and Cost-efficient LLM Serving in Cloud Environments,two-level hierarchical optimization; tabu search algorithm for GPU partition; a lightweight re-scheduling mechanism,,,

# ##### P-D Disaggregated System Optimizations
2025,arXiv,ByteDance,KVDirect: Distributed Disaggregated LLM Inference,tensor-centric communication mechanism; pull-based KV cache transfer; dynamic GPU resource scheduling via RDMA,,,
2025,arXiv,SYSU,Injecting Adrenaline into LLM Serving: Boosting Resource Utilization and Throughput via Attention Disaggregation,attention disaggregation and offloading mechanism; low-latency decoding synchronization; resource-efficient prefill colocation; load-aware offloading scheduling,4,4,3
2025,arXiv,Alibaba,FlowKV: A Disaggregated Inference Framework with Low-Latency KV Cache Transfer and Load-Aware Scheduling,analyze the communication patterns; KV cache structure adjustment method; load-aware scheduling,4,4,2
2025,arXiv,NUS & USTC,DynaServe: Unified and Elastic Tandem-Style Execution for Dynamic Disaggregated LLM Serving,a novel Tandem Serving execution model; two virtual subrequests; explicitly permit the two subrequests to execute on either GPU instance,3,4,2

# #### Throughput-Optimized Systems
2025,arXiv,HKUST,Improving the End-to-End Efficiency of Offline Inference for Multi-LLM Applications Based on Sampling and Simulation,sampling-then-simulation cost model; model-level pipeline parallelism; minimumtotal-latency application scheduling,4,4,3

# #### Fair Serving Systems
2024,arXiv,Virginia Tech,Ensuring Fair LLM Serving Amid Diverse Applications,multi-tenant LLM platform; overload and interaction-driven throttling; weighted service counter,,,
2025,arXiv,UIUC,Hierarchical Autoscaling for Large Language Model Serving with Chiron,hierarchical backpressure; interactive requests and batch requests; mixed instances,,,
2025,arXiv,Berkeley,Locality-aware Fair Scheduling in LLM Serving,deficit-based longest prefix matching; distributed deficit-round coordination; prefix-aware fairness bound analysis,,,

# ### RLHF System
# Challenge: RLHF system includes both training and inference. On top of that, multi agents(LLMs) when running in parallel, which makes the data flow more complex.
2025,EuroSys,HKU,HybridFlow: A Flexible and Efficient RLHF Framework,auto-mapping model placement; 3D-HybridEngine to reduce the communication overhead; hybrid programming,4,4,3
2025,arXiv,Alibaba,Reinforcement Learning Optimization for Large-Scale Learning: An Efficient and User-Friendly Scaling Library,bind many LLMs in one device cluster; fix the batch problem of long tail requests; reuse many utils in HybridFlow,4,4,2


# ### Communication-Computation Overlap
