Year,Venue,Authors,Title,Tags,P,E,N
2024,OSDI,SJTU & Alibaba,Infinite-LLM: Efficient LLM Service for Long Context with DistAttention and Distributed KVCache,inefficient model parallelism intra-instance; inefficient resource management inter-instance; KV cache scheduling,,,
2024,arXiv,SJTU,TokenRing: An Efficient Parallelism Framework for Infinite-Context LLMs via Bidirectional Communication,communication-oriented parallelism framework; inter-node P2P bidirectional communication bandwidth; optimization of attention block communication,,,
2025,arXiv,CWRU,Longer Attention Span: Increasing Transformer Context Length with Sparse Graph Processing Techniques,sparse attention with graph computing perspective; work-optimal graph algorithms; achieve true sparsity,,,
2025,MLSys,MIT,LServe: Efficient Long-sequence LLM Serving with Unified Sparse Attention,unified sparse attention; hybrid static and dynamic sparsity; hierarchical kv cache management with query-centric pruning,,,
2025,arXiv,PKU,"ByteScale: Efficient Scaling of LLM Training with a 2048K Context Length on More Than 12,000 GPUs",hybrid data parallelism; data-aware sharding; a heuristic algorithm that reorganizes data assignment based on the characteristics of data and pipeline parallelism,,,
# ##### P-D Disaggregated Systems
2024,OSDI,PKU,DistServe: Disaggregating Prefill and Decoding for Goodput-optimized Large Language Model Serving,goodput-optimized; prefill-decoding interference;novel placement algorithm for p-d schema,,,
2024,ISCA,UW,Splitwise: Efficient Generative LLM Inference Using Phase Splitting,optimized cache context transfer; performance per dollar; performance per watt; exploration of homogeneous and heterogeneous cluster deployments,,,
2024,arXiv,CMU,A System for Microserving of LLMs,fine-grained sub-request level actions; dynamic reconfiguration according to workloads; unified KV cache abstraction,,,
2025,arXiv,PKU,ThunderServe: High-performance and Cost-efficient LLM Serving in Cloud Environments,two-level hierarchical optimization; tabu search algorithm for GPU partition; a lightweight re-scheduling mechanism,,,
# ###### P-D Disaggregated System Optimizations
2025,arXiv,ByteDance,KVDirect: Distributed Disaggregated LLM Inference,tensor-centric communication mechanism; pull-based KV cache transfer; dynamic GPU resource scheduling via RDMA,,,
2025,arXiv,SYSU,Injecting Adrenaline into LLM Serving: Boosting Resource Utilization and Throughput via Attention Disaggregation,attention disaggregation and offloading mechanism; low-latency decoding synchronization; resource-efficient prefill colocation; load-aware offloading scheduling,4,4,3
2025,arXiv,Alibaba,FlowKV: A Disaggregated Inference Framework with Low-Latency KV Cache Transfer and Load-Aware Scheduling,analyze the communication patterns; KV cache structure adjustment method; load-aware scheduling,4,4,2
2025,arXiv,NUS & USTC,DynaServe: Unified and Elastic Tandem-Style Execution for Dynamic Disaggregated LLM Serving,a novel Tandem Serving execution model; two virtual subrequests; explicitly permit the two subrequests to execute on either GPU instance,3,4,2
# ##### Throughput-Optimized Systems
2025,arXiv,HKUST,Improving the End-to-End Efficiency of Offline Inference for Multi-LLM Applications Based on Sampling and Simulation,sampling-then-simulation cost model; model-level pipeline parallelism; minimumtotal-latency application scheduling,4,4,3
# ##### Fair Serving Systems
2024,arXiv,Virginia Tech,Ensuring Fair LLM Serving Amid Diverse Applications,multi-tenant LLM platform; overload and interaction-driven throttling; weighted service counter,,,
2025,arXiv,UIUC,Hierarchical Autoscaling for Large Language Model Serving with Chiron,hierarchical backpressure; interactive requests and batch requests; mixed instances,,,
2025,arXiv,Berkeley,Locality-aware Fair Scheduling in LLM Serving,deficit-based longest prefix matching; distributed deficit-round coordination; prefix-aware fairness bound analysis,,,
# ##### CPU-GPU Systems
2025,ISPASS,CMU,Characterizing and Optimizing LLM Inference Workloads on CPU-GPU Coupled Architectures,Effective regions for balanced utilization of PUs; Proximity-based kernel fusion recommendation; operator-kernel dependency graphs from PyTorch Profiler traces,3,4,2
# ##### Prefix Cache
2023,Nips,Stanford,SGLang: Efficient Execution of Structured Language Model Programs,KV-Cache share; python-like DSL; compute graph; LRU cache management stragety,4,4,3
2024,arXiv,Microsoft,ChunkAttention: Efficient Self-Attention with Prefix-Aware KV Cache and Two-Phase Partition,prefix aware attention compute; manage kv-cache chunks as prefix tree; reduce kv-cache redundancy,3,4,2
# #### Communication-Computation Overlap
2023,NSDI,KAIST,ARK: GPU-driven Code Execution for Distributed Deep Learning,communication-motivated DL system; pipeline DMA engine; GPU-direct-controlled DMA,,,
2024,ASPLOS,PKU,Centauri: Enabling Efficient Scheduling for Communication-Computation Overlap in Large Model Training via Communication Partitioning,communication partition abstraction; hybrid LLM training tasks; 3-level decompose,,,
2024,ASPLOS,UW–Madison,T3: Transparent Tracking & Triggering for Fine-grained Overlap of Compute & Collectives,lightweight track and trigger; pre-programmed DMA commands; atomic memory update,,,
2024,ASPLOS,UIUC,Two-Face: Combining Collective and One-Sided Communication for Efficient Distributed SpMM,distributed SpMM; sparsity-aware partition; Synchronous Stripes and Asynchronous Stripes,,,
2024,arXiv,AMD,Optimizing ML Concurrent Computation and Communication with GPU DMA Engines,concurrent computation and communication; compute and memory interference among concurrent kernels; schedule prioritization and careful resource partitioning,,,
# #### Tensor Execution Optimization
2025,OSDI,PKU,Mirage: A Multi-Level Superoptimizer for Tensor Programs,auto algebraically transfer tensor; using DAG to search configuration space; auto generate kernel function,4,4,3
# ### Heterogeneous Systems
# #### General Applications
2013,SOSP,MSR Silicon Valley,Dandelion: a Compiler and Runtime for Heterogeneous  Systems,unified programming model; “single machine” abstraction; a rich object-oriented programming language for data-parallel computing,,,
2025,EuroSys,SJTU,Improving GPU Sharing Performance through Adaptive Bubbleless Spatial-Temporal Sharing,Bubble-less spatial-temporal sharing; kernel squad scheduling; fine-grained concurrent kernel management,4,3,2
2020,ASPLOS,PKU,FlexTensor: An Automatic Schedule Exploration and Optimization Framework for Tensor Computation on Heterogeneous System,tvm auto schedule; RL based stragety find; auto optimizing in large configuration space,4,4,3
# #### Decentralized Serving
2019,ASPLOS,USC,Hop: Heterogeneity-aware Decentralized Training,iteration gap; queue-based synchronization; backup workers and bounded staleness,,,
2020,ASPLOS,USC,Prague: High-Performance Heterogeneity-Aware Asynchronous Decentralized Training,Partial All-Reduce to reduce synchronization cost; group scheduling to avoid conflicts,,,
2025,arXiv,Berkeley,DeServe: Towards Affordable Offline LLM Inference via Decentralization, decentralized LLM inference; high-latency optimization; idle GPU utilization; modular on-chain integration,,,
2025,arXiv,HKUST,DreamDDP: Accelerating Data Parallel Distributed LLM Training with Layer-wise Scheduled Partial Synchronization,partial synchronization based local SGD; DFS algorithm with pruned search space; enables the opportunity of overlapping communication and computation,,,
# #### ML Training Systems
2023,SOSP,CMU,"Sia: Heterogeneity-aware, goodput-optimized ML-cluster scheduling",heterogeneity-aware and adaptivity-aware; ILP formulation for scheduling; bootstrapped from observing just a few mini-batches,,,
# #### LLM Inference Systems
# ##### Mobile & Edge-Network Serving
2024,arXiv,UIC,Priority-Aware Model-Distributed Inference at Edge Networks,priority-aware model distributed inference algorithm; prioritization of ML inference tasks; model-distributed inferencing mechanism,,,
2024,arXiv,Yonsei,Uncertainty-Aware Hybrid Inference with On-Device Small and Remote Large Language Models,hybrid language model; selectively skip uplink transmissions; uncertainty-aware,,,
2024,arXiv,UMD,Distributed Mixture-of-Agents for Edge Inference with Large Language Models,Mixture-of-Agents; semantics of the data being gossiped and its timeliness; queuing stability,,,
2025,arXiv,PKU,SplitLLM: Hierarchical Split Learning for Large Language Model over Wireless Network,hierarchical split learning; edge-cloud collaboration; LoRA adapter update,,,
2025,arXiv,SJTU,HeteroLLM: Accelerating Large Language Model Inference on Mobile SoCs platform with Heterogeneous AI Accelerators,both layer-level and tensor-level GPU-NPU parallelism; different tensor partition strategies; fast synchronization mechanism based on predictable kernel waiting times; tensor partition solver,,,
# ##### Large Heterogeneous System Serving
2024,arXiv,CMU,Helix: Distributed Serving of Large Language Models via Max-Flow on Heterogeneous GPUs,LLM model placement as a max-flow problem; per-request pipeline; mixed integer linear programming,,,
2025,ICLR,HKUST,HexGen-2: Disaggregated Generative Inference of LLMs in Heterogeneous Environment,a combination of graph partitioning and max-flow algorithm; TP and PP with disaggregation; bottleneck and underutilized edges; swap edges,,,
2025,arXiv,CMU,Characterizing and Optimizing LLM Inference Workloads on CPU-GPU Coupled Architectures,SKIP profiling tool; TKLQT metric for CPU/GPU boundedness; proximity score kernel fusion,2,3,2
2025,SPAA,Huawei,WindVE: Collaborative CPU-NPU Vector Embedding,seamless CPU-NPU collaboration for vector embedding; linear regression based estimator; high-throughput offloading vector embedding,2,4,3
2025,arXiv,Huawei,High-Throughput LLM inference on Heterogeneous Clusters,lightweight profiling while avoiding resource-intensive throughput benchmarks; a scheduler that accounts for both instance computational capacity and memory usage; exhaustive search method,2,4,2
# #### LLM Training Systems
2024,arXiv,PKU,Demystifying Workload Imbalances in Large Transformer Model Training over Variable-length Sequences,data sampling imbalance; data packing imbalance; subgraph abstraction,,,
2024,arXiv,Ant Group,EDiT: A Local-SGD-Based Efficient Distributed Training Method for Large Language Models,Local Stochastic Gradient Descent (Local SGD); consistent stragglers within heterogeneous devices; hierarchical distribution strategy on a two-dimensional device mesh; layer by layer forward syncing; pseudo-gradient penalty method,,,
2024,arXiv,ZJU,Frenzy: A Memory-Aware Serverless LLM Training System for Heterogeneous GPU Clusters,efficient and low-overhead task-to-cluster scheduling; bin-packing algorithms; seamless and user-friendly,,,
2025,arXiv,OSU,Scaling Large Language Model Training on Frontier with Low-Bandwidth Partitioning,low-bandwidth interconnects; three-level hierarchical partitioning strategy; improved hierarchical partitioning on top of ZeRO++,,,
2025,arXiv,PKU,Split Fine-Tuning for Large Language Models in Wireless Networks,split fine-tuning; device and server partition; novel compression scheme and resource management algorithm,,,
2025,arXiv,Neuchatel,SkipPipe: Partial and Reordered Pipelining Framework for Training LLMs in Heterogeneous Networks,partial pipeline parallelism; stage skipping; path scheduling algorithm,,,